[
  {
    "evidence_id": "qo-loss-replay:sensitivity_guided_025",
    "hypothesis": "sensitivity_guided_025",
    "status": "supported",
    "result": {
      "candidate_id": "sensitivity_guided_025",
      "source_graph": "artifacts/sensitivity_guided_025.json",
      "pytheus_loss": null,
      "edge_count": 49,
      "loss_model": {
        "name": "per_edge_transmission_proxy",
        "detector_segment_penalty": true,
        "disclaimer": "Proxy for arena comparison; laboratory calibration is out of scope."
      },
      "loss_sweep": [
        {
          "transmission": 1.0,
          "count_rate": 0.9547065353639416,
          "fidelity": 0.9840842245425184
        },
        {
          "transmission": 0.95,
          "count_rate": 0.9310637176141737,
          "fidelity": 0.9840842245425186
        },
        {
          "transmission": 0.9,
          "count_rate": 0.8873997131466999,
          "fidelity": 0.9840842245425188
        },
        {
          "transmission": 0.8,
          "count_rate": 0.6797179003451514,
          "fidelity": 0.9840842245425188
        },
        {
          "transmission": 0.7,
          "count_rate": 0.3053163313868006,
          "fidelity": 0.9840842245425184
        }
      ],
      "robust_score": 0.739677892744063,
      "edge_budget": 55,
      "budget_feasible": true,
      "quality_tolerance": 0.02,
      "quality_deltas": [
        {
          "transmission": 1.0,
          "fidelity_relative_drop": 0.015051475078745158,
          "count_rate_relative_drop": 0.015230962560401795
        },
        {
          "transmission": 0.95,
          "fidelity_relative_drop": 0.015051475078745158,
          "count_rate_relative_drop": 0.01537541196863701
        },
        {
          "transmission": 0.9,
          "fidelity_relative_drop": 0.015051475078744825,
          "count_rate_relative_drop": 0.015642183876844573
        },
        {
          "transmission": 0.8,
          "fidelity_relative_drop": 0.015051475078744714,
          "count_rate_relative_drop": 0.016911047650949418
        },
        {
          "transmission": 0.7,
          "fidelity_relative_drop": 0.015051475078745158,
          "count_rate_relative_drop": 0.019198511254097883
        }
      ],
      "quality_acceptable": true,
      "protocol_feasible": true
    }
  },
  {
    "evidence_id": "qo-loss-replay:sparse_threshold_150",
    "hypothesis": "sparse_threshold_150",
    "status": "supported",
    "result": {
      "candidate_id": "sparse_threshold_150",
      "source_graph": "artifacts/sparse_threshold_150.json",
      "pytheus_loss": null,
      "edge_count": 49,
      "loss_model": {
        "name": "per_edge_transmission_proxy",
        "detector_segment_penalty": true,
        "disclaimer": "Proxy for arena comparison; laboratory calibration is out of scope."
      },
      "loss_sweep": [
        {
          "transmission": 1.0,
          "count_rate": 0.9547065353639416,
          "fidelity": 0.9840842245425184
        },
        {
          "transmission": 0.95,
          "count_rate": 0.9310637176141737,
          "fidelity": 0.9840842245425186
        },
        {
          "transmission": 0.9,
          "count_rate": 0.8873997131466999,
          "fidelity": 0.9840842245425188
        },
        {
          "transmission": 0.8,
          "count_rate": 0.6797179003451514,
          "fidelity": 0.9840842245425188
        },
        {
          "transmission": 0.7,
          "count_rate": 0.3053163313868006,
          "fidelity": 0.9840842245425184
        }
      ],
      "robust_score": 0.739677892744063,
      "edge_budget": 55,
      "budget_feasible": true,
      "quality_tolerance": 0.02,
      "quality_deltas": [
        {
          "transmission": 1.0,
          "fidelity_relative_drop": 0.015051475078745158,
          "count_rate_relative_drop": 0.015230962560401795
        },
        {
          "transmission": 0.95,
          "fidelity_relative_drop": 0.015051475078745158,
          "count_rate_relative_drop": 0.01537541196863701
        },
        {
          "transmission": 0.9,
          "fidelity_relative_drop": 0.015051475078744825,
          "count_rate_relative_drop": 0.015642183876844573
        },
        {
          "transmission": 0.8,
          "fidelity_relative_drop": 0.015051475078744714,
          "count_rate_relative_drop": 0.016911047650949418
        },
        {
          "transmission": 0.7,
          "fidelity_relative_drop": 0.015051475078745158,
          "count_rate_relative_drop": 0.019198511254097883
        }
      ],
      "quality_acceptable": true,
      "protocol_feasible": true
    }
  },
  {
    "evidence_id": "qo-loss-replay:sparse_threshold_120",
    "hypothesis": "sparse_threshold_120",
    "status": "supported",
    "result": {
      "candidate_id": "sparse_threshold_120",
      "source_graph": "artifacts/sparse_threshold_120.json",
      "pytheus_loss": null,
      "edge_count": 51,
      "loss_model": {
        "name": "per_edge_transmission_proxy",
        "detector_segment_penalty": true,
        "disclaimer": "Proxy for arena comparison; laboratory calibration is out of scope."
      },
      "loss_sweep": [
        {
          "transmission": 1.0,
          "count_rate": 0.9605010525758344,
          "fidelity": 0.9902419897358558
        },
        {
          "transmission": 0.95,
          "count_rate": 0.9365739637684338,
          "fidelity": 0.990241989735856
        },
        {
          "transmission": 0.9,
          "count_rate": 0.8924038622542919,
          "fidelity": 0.9902419897358559
        },
        {
          "transmission": 0.8,
          "count_rate": 0.6826499836693872,
          "fidelity": 0.990241989735856
        },
        {
          "transmission": 0.7,
          "count_rate": 0.3059065165405841,
          "fidelity": 0.9902419897358556
        }
      ],
      "robust_score": 0.7482338541607636,
      "edge_budget": 55,
      "budget_feasible": true,
      "quality_tolerance": 0.02,
      "quality_deltas": [
        {
          "transmission": 1.0,
          "fidelity_relative_drop": 0.008888301650364472,
          "count_rate_relative_drop": 0.009253983325617776
        },
        {
          "transmission": 0.95,
          "fidelity_relative_drop": 0.008888301650364472,
          "count_rate_relative_drop": 0.009548180440925313
        },
        {
          "transmission": 0.9,
          "fidelity_relative_drop": 0.00888830165036436,
          "count_rate_relative_drop": 0.010091276868280374
        },
        {
          "transmission": 0.8,
          "fidelity_relative_drop": 0.008888301650364139,
          "count_rate_relative_drop": 0.012670319663707463
        },
        {
          "transmission": 0.7,
          "fidelity_relative_drop": 0.008888301650364583,
          "count_rate_relative_drop": 0.017302594075880307
        }
      ],
      "quality_acceptable": true,
      "protocol_feasible": true
    }
  },
  {
    "evidence_id": "qo-loss-replay:sparse_threshold_080",
    "hypothesis": "sparse_threshold_080",
    "status": "supported",
    "result": {
      "candidate_id": "sparse_threshold_080",
      "source_graph": "artifacts/sparse_threshold_080.json",
      "pytheus_loss": null,
      "edge_count": 53,
      "loss_model": {
        "name": "per_edge_transmission_proxy",
        "detector_segment_penalty": true,
        "disclaimer": "Proxy for arena comparison; laboratory calibration is out of scope."
      },
      "loss_sweep": [
        {
          "transmission": 1.0,
          "count_rate": 0.9652950826432117,
          "fidelity": 0.9953382883027617
        },
        {
          "transmission": 0.95,
          "count_rate": 0.941131553514887,
          "fidelity": 0.9953382883027619
        },
        {
          "transmission": 0.9,
          "count_rate": 0.8965407552958365,
          "fidelity": 0.9953382883027619
        },
        {
          "transmission": 0.8,
          "count_rate": 0.6850680857733056,
          "fidelity": 0.9953382883027619
        },
        {
          "transmission": 0.7,
          "count_rate": 0.30639114370198206,
          "fidelity": 0.9953382883027618
        }
      ],
      "robust_score": 0.755347619593225,
      "edge_budget": 55,
      "budget_feasible": true,
      "quality_tolerance": 0.02,
      "quality_deltas": [
        {
          "transmission": 1.0,
          "fidelity_relative_drop": 0.0037875271121222687,
          "count_rate_relative_drop": 0.0043089953109416435
        },
        {
          "transmission": 0.95,
          "fidelity_relative_drop": 0.0037875271121222687,
          "count_rate_relative_drop": 0.004728408344106372
        },
        {
          "transmission": 0.9,
          "fidelity_relative_drop": 0.0037875271121220466,
          "count_rate_relative_drop": 0.005502383115463916
        },
        {
          "transmission": 0.8,
          "fidelity_relative_drop": 0.0037875271121219356,
          "count_rate_relative_drop": 0.009172972510120614
        },
        {
          "transmission": 0.7,
          "fidelity_relative_drop": 0.0037875271121221576,
          "count_rate_relative_drop": 0.015745772535326608
        }
      ],
      "quality_acceptable": true,
      "protocol_feasible": true
    }
  },
  {
    "evidence_id": "qo-loss-replay:sparse_threshold_200",
    "hypothesis": "sparse_threshold_200",
    "status": "refuted",
    "result": {
      "candidate_id": "sparse_threshold_200",
      "source_graph": "artifacts/sparse_threshold_200.json",
      "pytheus_loss": null,
      "edge_count": 48,
      "loss_model": {
        "name": "per_edge_transmission_proxy",
        "detector_segment_penalty": true,
        "disclaimer": "Proxy for arena comparison; laboratory calibration is out of scope."
      },
      "loss_sweep": [
        {
          "transmission": 1.0,
          "count_rate": 0.9459490559641365,
          "fidelity": 0.9747821181098213
        },
        {